{
  "external_location_grants": [
    {
      "location_name": "loc_supply_raw",
      "grants": [
        {
          "principal": "data_engineers",
          "privileges": [
            "CREATE_EXTERNAL_TABLE",
            "CREATE_EXTERNAL_VOLUME"
          ]
        },
        {
          "principal": "metastore_admins",
          "privileges": [
            "ALL_PRIVILEGES"
          ]
        }
      ]
    },
    {
      "location_name": "loc_supply_managed",
      "grants": [
        {
          "principal": "data_engineers",
          "privileges": [
            "ALL_PRIVILEGES"
          ]
        },
        {
          "principal": "metastore_admins",
          "privileges": [
            "ALL_PRIVILEGES"
          ]
        }
      ]
    }
  ],
  "catalog_grants": [
    {
      "catalog_name": "supplies_azure",
      "grants": [
        {
          "principal": "data_engineers",
          "privileges": [
            "USE_CATALOG",
            "CREATE_SCHEMA"
          ]
        },
        {
          "principal": "metastore_admins",
          "privileges": [
            "ALL_PRIVILEGES"
          ]
        }
      ]
    },
    {
      "catalog_name": "supply_sql_master",
      "grants": [
        {
          "principal": "data_engineers",
          "privileges": [
            "USE_CATALOG"
          ]
        },
        {
          "principal": "metastore_admins",
          "privileges": [
            "ALL_PRIVILEGES"
          ]
        }
      ]
    }
  ],
  "schema_grants": [
    {
      "schema": "supplies_azure.bronze",
      "grants": [
        {
          "principal": "data_engineers",
          "privileges": [
            "USE_SCHEMA",
            "CREATE_TABLE",
            "SELECT",
            "MODIFY"
          ]
        },
        {
          "principal": "metastore_admins",
          "privileges": [
            "ALL_PRIVILEGES"
          ]
        }
      ]
    },
    {
      "schema": "supplies_azure.silver",
      "grants": [
        {
          "principal": "data_engineers",
          "privileges": [
            "USE_SCHEMA",
            "CREATE_TABLE",
            "SELECT",
            "MODIFY"
          ]
        },
        {
          "principal": "data_scientists",
          "privileges": [
            "USE_SCHEMA",
            "SELECT"
          ]
        },
        {
          "principal": "metastore_admins",
          "privileges": [
            "ALL_PRIVILEGES"
          ]
        }
      ]
    },
    {
      "schema": "supply_sql_master.inventory",
      "grants": [
        {
          "principal": "data_scientists",
          "privileges": [
            "USE_SCHEMA",
            "SELECT"
          ]
        },
        {
          "principal": "metastore_admins",
          "privileges": [
            "ALL_PRIVILEGES"
          ]
        }
      ]
    },
    {
      "schema": "supply_sql_master.orders",
      "grants": [
        {
          "principal": "analysts",
          "privileges": [
            "USE_SCHEMA",
            "SELECT"
          ]
        },
        {
          "principal": "metastore_admins",
          "privileges": [
            "ALL_PRIVILEGES"
          ]
        }
      ]
    },
    {
      "schema": "supplies_azure.gold",
      "grants": [
        {
          "principal": "data_engineers",
          "privileges": [
            "USE_SCHEMA",
            "CREATE_TABLE",
            "SELECT",
            "MODIFY"
          ]
        },
        {
          "principal": "analysts",
          "privileges": [
            "USE_SCHEMA",
            "SELECT"
          ]
        },
        {
          "principal": "business_users",
          "privileges": [
            "USE_SCHEMA",
            "SELECT"
          ]
        },
        {
          "principal": "metastore_admins",
          "privileges": [
            "ALL_PRIVILEGES"
          ]
        }
      ]
    }
  ],
  "volume_grants": [
    {
      "volume": "supplies_azure.bronze.supplies_landing_zone",
      "grants": [
        {
          "principal": "data_engineers",
          "privileges": [
            "READ_VOLUME",
            "WRITE_VOLUME"
          ]
        },
        {
          "principal": "metastore_admins",
          "privileges": [
            "ALL_PRIVILEGES"
          ]
        }
      ]
    }
  ]
}
